1,You are in the foyer of the old haunted house. The floors are creaky. It is quite dark in here.,4,0,5,2
2,You are in the dining room.,3,0,1,0
3,You are in the kitchen. It smells really bad in here.,0,2,4,0
4,You are in the hallway of the old haunted house. Spider webs hang from the ceiling.,7,1,6,3
5,You are in the sitting room. The furniture in this room is in bad shape.,0,0,0,1
6,You are in the library. It is dark and creepy in here.,0,0,0,4
7,You are in the bedroom of the old haunted house.,0,4,0,8
8,You are in a large walk-in closet.,0,0,7,0
